{
  "surface_type": "runtime_evidence_selection",
  "selection_id": "return-anchor-integrity-wrapper-v1",
  "source_repo": "abyss-stack",
  "source_schema_ref": "repo:abyss-stack/mechanics/governed-execution/parts/return-policy/schemas/runtime-return-event.schema.json",
  "source_manifests": [
    "repo:abyss-stack/Logs/phase-alpha/alpha-05-restartable-inquiry-loop/inquiry_checkpoint.json",
    "repo:abyss-stack/Logs/phase-alpha/alpha-05-restartable-inquiry-loop/next_pass_brief.md"
  ],
  "bounded_claim": "On the bounded Phase Alpha checkpoint and rerun family, selected runtime evidence can show whether pause/resume named explicit return anchors and bounded rebuild posture without turning that read into final-quality or capability claims. This is return-hygiene evidence only.",
  "promotion_target": "evidence-sidecar",
  "comparison_mode": "none",
  "candidate_eval_refs": [
    "candidate:aoa-return-anchor-integrity"
  ],
  "selected_evidence": [
    {
      "artifact_ref": "repo:abyss-stack/Logs/phase-alpha/alpha-05-restartable-inquiry-loop/inquiry_checkpoint.json",
      "evidence_role": "summary",
      "summary_only": true
    },
    {
      "artifact_ref": "repo:abyss-stack/Logs/phase-alpha/alpha-05-restartable-inquiry-loop/decision_ledger.md",
      "evidence_role": "case-breakdown",
      "summary_only": true
    },
    {
      "artifact_ref": "repo:abyss-stack/Logs/phase-alpha/alpha-05-restartable-inquiry-loop/next_pass_brief.md",
      "evidence_role": "environment-note",
      "summary_only": true
    },
    {
      "artifact_ref": "repo:abyss-stack/Logs/phase-alpha/alpha-06-validation-driven-remediation-recall-rerun/revalidation_pack.json",
      "evidence_role": "integrity-sidecar",
      "summary_only": true
    }
  ],
  "environment_invariants": [
    "same checkpoint-first route family inside Phase Alpha",
    "same context rebuild class: landed memo anchors plus selected route surfaces",
    "same redaction posture for runtime evidence publication"
  ],
  "environment_deltas": [
    "pause and resume are separated into checkpoint and rerun surfaces while the return-anchor contract stays unchanged"
  ],
  "excluded_artifacts": [
    "repo:abyss-stack/Logs/phase-alpha/alpha-05-restartable-inquiry-loop/resume_health.json"
  ],
  "do_not_overread": [
    "does not prove final answer quality",
    "does not prove broad long-horizon capability",
    "does not replace scope, approval, or verification evals"
  ],
  "review_posture": {
    "portable_enough": false,
    "comparison_hygiene_named": true,
    "human_review_required": true
  }
}
